{
  "$schema": "https://json-schema.org/draft/2020-12/schema",
  "$id": "aiwf/workflow.schema.json",
  "title": "AIWF Workflow Definition",
  "type": "object",
  "required": ["workflow_id", "version", "nodes", "edges"],
  "properties": {
    "workflow_id": { "type": "string", "minLength": 1 },
    "version": { "type": "string", "minLength": 1 },
    "name": { "type": "string" },
    "description": { "type": "string" },
    "nodes": {
      "type": "array",
      "minItems": 1,
      "items": {
        "type": "object",
        "required": ["id", "type"],
        "properties": {
          "id": { "type": "string", "minLength": 1 },
          "type": { "type": "string", "minLength": 1 },
          "name": { "type": "string" },
          "config": { "type": "object" }
        },
        "additionalProperties": true
      }
    },
    "edges": {
      "type": "array",
      "items": {
        "type": "object",
        "required": ["from", "to"],
        "properties": {
          "from": { "type": "string" },
          "to": { "type": "string" },
          "when": {
            "oneOf": [
              { "type": "boolean" },
              { "type": "string" },
              {
                "type": "object",
                "properties": {
                  "field": { "type": "string" },
                  "op": { "type": "string" },
                  "value": {}
                },
                "additionalProperties": true
              }
            ]
          }
        },
        "additionalProperties": false
      }
    }
  },
  "additionalProperties": false
}
